activity_id,attraction_id,activity_name,activity_full_name,activity_description,activities_keywords,min_duration,max_duration,price,currency
1,1,Taking a guided tour,Taking a guided tour at Tower of London,Guided tour by a Yeoman Warder to learn about the history and legends of the Tower.,"Educational, Guided, Tour, History, Beginner-Friendly, Family-Friendly, Wheelchair Accessible, Scenic, Tourist Attraction, Traditional, Full-Day",1 hour,2 hours,25,GBP
2,1,Visiting the Jewel House,Visiting the Jewel House at Tower of London,Visit the Jewel House to see the Crown Jewels and other royal regalia.,"Educational, History, Guided, Museum, Beginner-Friendly, Family-Friendly, Wheelchair Accessible, Tourist Attraction, Traditional, Short (1-2 hours)",1 hour,1.5 hours,20,GBP
3,1,Observing the ravens,Observing the ravens at Tower of London,Observe the famous ravens of the Tower and learn about the legend that surrounds them.,"Educational, Interactive, Scenic, Local Experience, Family-Friendly, Pet-Friendly, Traditional, Short (1-2 hours)",30 minutes,1 hour,Free,-
4,1,Attending a medieval banquet,Attending a medieval banquet at Tower of London,Attend a themed medieval banquet within the Tower's historic walls.,"Cultural Immersion, Interactive, Traditional, Luxury, Guided, Food Festivals, Evening, Groups, Family-Friendly",3 hours,4 hours,100,GBP
5,2,Exploring royal fashion,Exploring royal fashion at Kensington Palace,Explore the fashion and style of the royals through the centuries.,"Educational, History, Guided, Art & Design, Fashion, Museum, Scenic, Luxury, Traditional, Mid-Range, Family-Friendly",1 hour,2 hours,15,GBP
6,2,Strolling through the Sunken Garden,Strolling through the Sunken Garden at Kensington Palace,"Stroll through the beautiful Sunken Garden, redesigned in memory of Princess Diana.","Relaxing, Scenic, Outdoors, Family-Friendly, Kid-Friendly, Couples, Nature & Wildlife, Short (1-2 hours)",30 minutes,1 hour,Free,-
7,2,Discovering Queen Victoria's life,Discovering Queen Victoria's life at Kensington Palace,Discover the life and legacy of Queen Victoria in the exhibition dedicated to her.,"Educational, History, Guided, Traditional, Scenic, Museum, Family-Friendly, Intermediate, Mid-Range, Short (1-2 hours)",1 hour,2 hours,15,GBP
8,2,Enjoying afternoon tea,Enjoying afternoon tea at Kensington Palace,Enjoy a traditional afternoon tea in the Orangery or Palace Gardens.,"Cultural Immersion, Local Cuisine, Traditional, Gourmet Experiences, Couples, Family-Friendly, Mid-Range, Luxury, Fixed Duration, Low Exertion",1.5 hours,2 hours,30,GBP
9,3,Watching the Changing of the Guard,Watching the Changing of the Guard at Buckingham Palace,Witness the iconic Changing of the Guard ceremony outside the palace.,"Cultural Immersion, Scenic, Guided, Traditional, Wheelchair Accessible, Family-Friendly, Tourist Attraction, Best Time to Visit, Large Groups, Morning",45 minutes,1 hour,Free,-
10,3,Touring the State Rooms,Touring the State Rooms at Buckingham Palace,"Take a guided tour of the State Rooms, open to the public during the summer months.","Educational, History, Guided, Art & Design, Architecture, Traditional, Luxury, Full-Day, Family-Friendly, Scenic, Mid-Range, Large Groups",2 hours,3 hours,25,GBP
11,3,Visiting the Royal Mews,Visiting the Royal Mews at Buckingham Palace,Visit the Royal Mews to see the historic carriages and horses used by the royal family.,"Educational, History, Guided, Traditional, Family-Friendly, Wheelchair Accessible, Kid-Friendly, Guided Tours, Short (1-2 hours)",1 hour,1.5 hours,15,GBP
12,3,Exploring the gardens,Exploring the gardens at Buckingham Palace,Explore the vast gardens of Buckingham Palace on a guided tour.,"Relaxing, Scenic, Outdoors, Nature & Wildlife, Family-Friendly, Kid-Friendly, Elderly-Friendly, Guided, Couples, Walking, Short (1-2 hours)",1 hour,2 hours,10,GBP
13,4,Navigating the maze,Navigating the maze at Hampton Court Palace,"Navigate the famous maze, one of the oldest surviving hedge mazes in the UK.","Adventure, Interactive, Family-Friendly, Kid-Friendly, Fun, Outdoors, Moderate Exertion, Scenic, Traditional, Couples, Guided",45 minutes,1 hour,5,GBP
14,4,Discovering Tudor kitchens,Discovering Tudor kitchens at Hampton Court Palace,Discover the kitchens that once served Henry VIII and his court.,"Educational, History, Traditional, Culinary, Guided, Mid-Range, Family-Friendly, Kid-Friendly, Interactive, Short (1-2 hours)",1 hour,1.5 hours,12,GBP
15,4,Playing in the Magic Garden,Playing in the Magic Garden at Hampton Court Palace,Let children play and explore in the whimsical Magic Garden.,"Adventure, Interactive, Family-Friendly, Kid-Friendly, Outdoors, Scenic, Fun, Seasonal, Best Time to Visit, Short (1-2 hours)",1 hour,2 hours,10,GBP
16,4,Watching historic reenactments,Watching historic reenactments at Hampton Court Palace,Watch costumed actors reenact scenes from the palace's rich history.,"Cultural Immersion, History, Traditional, Guided, Educational, Interactive, Family-Friendly, Kid-Friendly, Seasonal Events, Fixed Duration, Groups",1 hour,1.5 hours,15,GBP
17,5,Watching the Changing of the Guard,Watching the Changing of the Guard at Windsor Castle,Experience the Changing of the Guard ceremony in the castle grounds.,"Cultural Immersion, Scenic, Guided, Traditional, Wheelchair Accessible, Family-Friendly, Tourist Attraction, Best Time to Visit, Large Groups, Morning",45 minutes,1 hour,Free,-
18,5,Visiting St George's Chapel,Visiting St George's Chapel at Windsor Castle,Visit the chapel where many royal weddings and ceremonies take place.,"Educational, History, Guided, Architecture, Traditional, Family-Friendly, Wheelchair Accessible, Religious, Scenic, Short (1-2 hours)",1 hour,1.5 hours,12,GBP
19,5,Exploring Queen Mary’s Dolls' House,Exploring Queen Mary’s Dolls' House at Windsor Castle,Marvel at the intricate details of Queen Mary's Dolls' House.,"Educational, History, Traditional, Family-Friendly, Kid-Friendly, Museum, Architecture, Scenic, Short (1-2 hours), Fixed Duration",1 hour,1.5 hours,10,GBP
20,5,Touring the State Apartments,Touring the State Apartments at Windsor Castle,Explore the grand State Apartments and their magnificent art collections.,"Educational, History, Guided, Art & Design, Architecture, Traditional, Luxury, Full-Day, Family-Friendly, Scenic, Mid-Range, Large Groups",1.5 hours,2.5 hours,25,GBP
21,6,Touring Art Deco interiors,Touring Art Deco interiors at Eltham Palace,Explore the stunning Art Deco interiors of Eltham Palace.,"Educational, History, Guided, Art & Design, Architecture, Traditional, Luxury, Full-Day, Family-Friendly, Scenic, Mid-Range, Large Groups",1 hour,1.5 hours,12,GBP
22,6,Visiting the Great Hall,Visiting the Great Hall at Eltham Palace,Visit the impressive Great Hall and learn about its medieval history.,"Educational, History, Guided, Art & Design, Architecture, Traditional, Family-Friendly, Scenic, Short (1-2 hours), Mid-Range",1 hour,1.5 hours,10,GBP
23,6,Strolling through the gardens,Strolling through the gardens at Eltham Palace,Stroll through the beautiful gardens and around the moat.,"Relaxing, Scenic, Outdoors, Nature & Wildlife, Family-Friendly, Kid-Friendly, Elderly-Friendly, Guided, Couples, Walking, Short (1-2 hours)",30 minutes,1 hour,Free,-
24,6,Engaging with interactive exhibits,Engaging with interactive exhibits at Eltham Palace,Engage with interactive exhibits that bring the palace’s history to life.,"Interactive, Educational, History, Technology, Family-Friendly, Kid-Friendly, Guided, Museum, Fun, Mid-Range, Short (1-2 hours)",1 hour,2 hours,10,GBP
25,7,Attending a garden open day,Attending a garden open day at Lambeth Palace,Attend one of the garden open days to explore the historic gardens.,"Cultural Immersion, Scenic, Outdoors, Nature & Wildlife, Family-Friendly, Kid-Friendly, Guided, Traditional, Seasonal Events, Fixed Duration, Community Engagement",2 hours,4 hours,5,GBP
26,7,Touring the library and archives,Touring the library and archives at Lambeth Palace,Discover rare books and manuscripts in the Lambeth Palace Library.,"Educational, History, Guided, Literature, Museum, Family-Friendly, Kid-Friendly, Quiet, Traditional, Scenic, Short (1-2 hours)",1 hour,1.5 hours,8,GBP
27,7,Exploring the architecture,Exploring the architecture at Lambeth Palace,Take a guided tour focusing on the architecture and history of the palace.,"Educational, History, Guided, Architecture, Traditional, Family-Friendly, Kid-Friendly, Wheelchair Accessible, Scenic, Fixed Duration",1 hour,2 hours,10,GBP
28,7,Participating in seasonal events,Participating in seasonal events at Lambeth Palace,Participate in seasonal events such as Christmas fairs or summer fêtes.,"Cultural Immersion, Traditional, Seasonal Events, Family-Friendly, Kid-Friendly, Community Engagement, Guided, Fun, Best Time to Visit, Fixed Duration",2 hours,4 hours,15,GBP
29,8,Touring Clarence House,Touring Clarence House at St James's Palace,"Visit Clarence House, the official residence of the Prince of Wales, located nearby.","Educational, History, Guided, Architecture, Traditional, Family-Friendly, Kid-Friendly, Wheelchair Accessible, Scenic, Short (1-2 hours)",1 hour,1.5 hours,15,GBP
30,8,Watching the Changing of the Guard,Watching the Changing of the Guard at St James's Palace,Watch the guard change ceremony that takes place at St James's Palace.,"Cultural Immersion, Scenic, Guided, Traditional, Wheelchair Accessible, Family-Friendly, Tourist Attraction, Best Time to Visit, Large Groups, Morning",45 minutes,1 hour,Free,-
31,9,Admiring the Ceiling of Rubens,Admiring the Ceiling of Rubens at Whitehall Palace (Banqueting House),Admire the magnificent ceiling paintings by Sir Peter Paul Rubens.,"Art & Design, Architecture, Scenic, Traditional, History, Guided, Family-Friendly, Short (1-2 hours), Museum, Cultural Heritage",30 minutes,1 hour,8,GBP
32,9,Taking a historical tour,Taking a historical tour at Whitehall Palace (Banqueting House),Learn about the history of Whitehall Palace and its importance in British history.,"Educational, History, Guided, Traditional, Architecture, Family-Friendly, Kid-Friendly, Wheelchair Accessible, Scenic, Short (1-2 hours)",1 hour,1.5 hours,10,GBP
33,9,Experiencing banquet reenactments,Experiencing banquet reenactments at Whitehall Palace (Banqueting House),Experience reenactments of historic banquets held in the Banqueting House.,"Cultural Immersion, History, Traditional, Guided, Family-Friendly, Kid-Friendly, Food Festivals, Evening, Large Groups, Fixed Duration",2 hours,3 hours,50,GBP
34,9,Exploring the architecture,Exploring the architecture at Whitehall Palace (Banqueting House),Explore the architectural significance of this remaining part of the once-great palace.,"Educational, History, Guided, Architecture, Traditional, Family-Friendly, Kid-Friendly, Wheelchair Accessible, Scenic, Fixed Duration",1 hour,1.5 hours,10,GBP
35,10,Strolling through the botanical gardens,Strolling through the botanical gardens at Fulham Palace,Wander through the beautiful botanical gardens surrounding Fulham Palace.,"Relaxing, Scenic, Outdoors, Nature & Wildlife, Family-Friendly, Kid-Friendly, Elderly-Friendly, Couples, Walking, Short (1-2 hours)",1 hour,2 hours,5,GBP
36,10,Exploring the Tudor courtyard,Exploring the Tudor courtyard at Fulham Palace,Explore the historic Tudor courtyard and its significance.,"Educational, History, Guided, Architecture, Traditional, Family-Friendly, Kid-Friendly, Scenic, Short (1-2 hours)",1 hour,1.5 hours,8,GBP
37,10,Visiting the museum,Visiting the museum at Fulham Palace,Visit the museum to learn about the palace’s history and former residents.,"Educational, History, Guided, Museum, Traditional, Family-Friendly, Kid-Friendly, Indoor, Short (1-2 hours)",1 hour,2 hours,10,GBP
38,10,Participating in seasonal workshops,Participating in seasonal workshops at Fulham Palace,"Participate in workshops such as gardening, art, and history-themed activities.","Interactive, Educational, History, Art & Craft, Family-Friendly, Kid-Friendly, Workshops, Seasonal, Traditional, Hands-On, Short (1-2 hours)",2 hours,4 hours,15,GBP
39,11,Exploring the palace ruins,Exploring the palace ruins at Richmond Palace,Discover the hidden history of a royal residence through its picturesque ruins.,"Educational, History, Traditional, Scenic, Architecture, Family-Friendly, Kid-Friendly, Walking, Off the Beaten Path, Fixed Duration",1 hour,1.5 hours,Free,-
40,11,Walking along the River Thames,Walking along the River Thames at Richmond Palace,"Enjoy a leisurely stroll along the River Thames, passing by the historic Richmond Palace.","Relaxing, Scenic, Outdoors, Nature & Wildlife, Family-Friendly, Kid-Friendly, Couples, Walking, Short (1-2 hours)",1 hour,2 hours,Free,-
41,11,Visiting the Richmond Museum,Visiting the Richmond Museum at Richmond Palace,Explore the rich history of Richmond Palace through artifacts and exhibits at the museum.,"Educational, History, Guided, Museum, Traditional, Family-Friendly, Kid-Friendly, Indoor, Short (1-2 hours)",1 hour,1.5 hours,8,GBP
42,11,Enjoying the Richmond Green,Enjoying the Richmond Green at Richmond Palace,Experience the historic beauty of Richmond Palace while relaxing in the tranquil Richmond Green.,"Relaxing, Scenic, Outdoors, Nature & Wildlife, Family-Friendly, Kid-Friendly, Couples, Picnic, Short (1-2 hours)",30 minutes,1 hour,Free,-
43,12,Touring the Old Royal Naval College,Touring the Old Royal Naval College at Greenwich Palace,Explore the historic grounds and stunning architecture of the Old Royal Naval College.,"Educational, History, Guided, Architecture, Traditional, Family-Friendly, Kid-Friendly, Scenic, Walking, Short (1-2 hours)",1.5 hours,2.5 hours,12,GBP
44,12,Visiting the Queen's House,Visiting the Queen's House at Greenwich Palace,Explore the stunning architecture and art collection of the Queen's House.,"Educational, History, Guided, Museum, Art & Design, Traditional, Family-Friendly, Kid-Friendly, Scenic, Short (1-2 hours)",1 hour,2 hours,10,GBP
45,12,Exploring the Greenwich Park,Exploring the Greenwich Park at Greenwich Palace,Discover the rich history and royal connections of Greenwich Palace while exploring the beautiful Greenwich Park.,"Relaxing, Scenic, Outdoors, Nature & Wildlife, Family-Friendly, Kid-Friendly, Walking, Traditional, Full-Day",1.5 hours,3 hours,Free,-
46,12,Learning at the National Maritime Museum,Learning at the National Maritime Museum at Greenwich Palace,Explore maritime history through interactive exhibits and hands-on activities.,"Educational, History, Guided, Museum, Traditional, Family-Friendly, Kid-Friendly, Indoor, Technology, Short (1-2 hours)",1.5 hours,2.5 hours,15,GBP
47,13,Viewing the art collection,Viewing the art collection at The Queen's House,Explore a historic royal art collection in a stunning 17th century building.,"Art & Design, Scenic, Museum, Traditional, Family-Friendly, Kid-Friendly, Guided, Educational, Short (1-2 hours)",1 hour,2 hours,10,GBP
48,13,Walking through the Tulip Stairs,"Walking through the Tulip Stairs at The Queen's House	","Unique spiral staircase in the first centrally unsupported helical stairs in Britain.	","Scenic, Architecture, Museum, Traditional, Family-Friendly, Kid-Friendly, Guided, Educational, Short (1-2 hours)",30 minutes,1 hour,Free,
49,13,Enjoying the views from the Great Hall,Enjoying the views from the Great Hall at The Queen's House,Unique views of London's skyline from a historic building.,"Scenic, Architecture, Museum, Traditional, Family-Friendly, Kid-Friendly, Guided, Educational, Short (1-2 hours)",30 minutes,1 hour,Free,-
50,13,Attending an art workshop,Attending an art workshop at The Queen's House,Immerse yourself in a historic setting while exploring your creativity.,"Interactive, Educational, Art & Craft, Family-Friendly, Kid-Friendly, Workshops, Traditional, Hands-On, Short (1-2 hours)",2 hours,4 hours,20,GBP
51,14,Touring the royal residence,Touring the royal residence at Clarence House,Explore the historic home of the British royal family.,"Educational, History, Guided, Architecture, Traditional, Family-Friendly, Kid-Friendly, Scenic, Short (1-2 hours)",1 hour,1.5 hours,15,GBP
52,14,Exploring the gardens,Exploring the gardens at Clarence House,Discover the hidden oasis within the heart of London.,"Relaxing, Scenic, Outdoors, Nature & Wildlife, Family-Friendly, Kid-Friendly, Elderly-Friendly, Couples, Walking, Short (1-2 hours)",30 minutes,1 hour,Free,-
53,14,Viewing the art and furnishings,Viewing the art and furnishings at Clarence House,Exploring the royal collection at Clarence House offers a glimpse into the personal tastes of the British royal family.,"Art & Design, Scenic, Museum, Traditional, Family-Friendly, Kid-Friendly, Guided, Educational, Short (1-2 hours)",1 hour,1.5 hours,10,GBP
54,14,Attending a guided tour,Attending a guided tour at Clarence House,Explore the official London residence of The Prince of Wales and The Duchess of Cornwall.,"Educational, History, Guided, Architecture, Traditional, Family-Friendly, Kid-Friendly, Scenic, Short (1-2 hours)",1 hour,1.5 hours,15,GBP
55,15,Touring the historic interiors,Touring the historic interiors at Marlborough House,Exploring the opulent and grandiose royal residence of Marlborough House.,"Educational, History, Guided, Architecture, Traditional, Family-Friendly, Kid-Friendly, Scenic, Short (1-2 hours)",1 hour,1.5 hours,12,GBP
56,15,Exploring the gardens,Exploring the gardens at Marlborough House,Experience the tranquil beauty of Marlborough House gardens.,"Relaxing, Scenic, Outdoors, Nature & Wildlife, Family-Friendly, Kid-Friendly, Elderly-Friendly, Couples, Walking, Short (1-2 hours)",30 minutes,1 hour,Free,-
57,15,Learning about Commonwealth history,Learning about Commonwealth history at Marlborough House,Exploring the rich history of the Commonwealth at Marlborough House.,"Educational, History, Guided, Museum, Traditional, Family-Friendly, Kid-Friendly, Indoor, Short (1-2 hours)",1 hour,2 hours,10,GBP
58,15,Attending cultural events,Attending cultural events at Marlborough House,Unique opportunity to experience royal history and culture at a historic royal residence.,"Cultural Immersion, Traditional, Guided, Family-Friendly, Kid-Friendly, Events, Community Engagement, Fixed Duration",2 hours,4 hours,20,GBP
59,16,Ice skating in the courtyard,Ice skating in the courtyard at Somerset House,Ice skating in the courtyard at Somerset House offers a magical winter experience in London.,"Adventure, Interactive, Family-Friendly, Kid-Friendly, Fun, Outdoor, Seasonal, Moderate Exertion, Winter, Couples",1 hour,2 hours,15,GBP
60,16,Visiting the art galleries,Visiting the art galleries at Somerset House,Explore diverse and thought-provoking contemporary art exhibitions in a historic setting.,"Art & Design, Scenic, Museum, Traditional, Family-Friendly, Kid-Friendly, Guided, Educational, Short (1-2 hours)",1 hour,2 hours,10,GBP
61,16,Enjoying outdoor cinema screenings,Enjoying outdoor cinema screenings at Somerset House,Watching classic films under the stars in the historic courtyard of Somerset House.,"Relaxing, Scenic, Entertainment, Family-Friendly, Kid-Friendly, Couples, Outdoor, Evening, Seasonal Events",2 hours,4 hours,20,GBP
62,16,Participating in workshops,Participating in workshops at Somerset House,Opportunity to learn new skills and techniques from industry experts in a historic setting.,"Interactive, Educational, Art & Craft, Family-Friendly, Kid-Friendly, Workshops, Traditional, Hands-On, Short (1-2 hours)",2 hours,4 hours,15,GBP
63,17,Touring the historic house,Touring the historic house at Syon House,Explore the grandeur and history of Syon House through a guided tour of its historic rooms and gardens.,"Educational, History, Guided, Architecture, Traditional, Family-Friendly, Kid-Friendly, Scenic, Short (1-2 hours)",1.5 hours,2.5 hours,15,GBP
64,17,Exploring the gardens and Great Conservatory,Exploring the gardens and Great Conservatory at Syon House,Discover the exquisite beauty of the gardens and Great Conservatory at Syon House.,"Relaxing, Scenic, Outdoors, Nature & Wildlife, Family-Friendly, Kid-Friendly, Elderly-Friendly, Couples, Walking, Short (1-2 hours)",1 hour,2 hours,10,GBP
65,17,Visiting the Syon Park Garden Centre,Visiting the Syon Park Garden Centre at Syon House,Explore a historic garden center located on the grounds of a stunning stately home.,"Relaxing, Scenic, Outdoors, Nature & Wildlife, Family-Friendly, Kid-Friendly, Couples, Shopping, Short (1-2 hours)",1 hour,2 hours,Free,-
66,17,Attending seasonal events,Attending seasonal events at Syon House,Experience the grandeur of a historic stately home while enjoying a variety of seasonal events.,"Cultural Immersion, Traditional, Seasonal Events, Family-Friendly, Kid-Friendly, Community Engagement, Guided, Fun, Best Time to Visit, Fixed Duration",2 hours,4 hours,20,GBP
67,18,Exploring the royal kitchens,Exploring the royal kitchens at Kew Palace,Get a taste of royal history by exploring the kitchens at Kew Palace.,"Educational, History, Traditional, Culinary, Guided, Family-Friendly, Kid-Friendly, Short (1-2 hours), Indoor",1 hour,1.5 hours,10,GBP
68,18,Walking through the Kew Gardens,Walking through the Kew Gardens at Kew Palace,Experience the beauty of a UNESCO World Heritage Site.,"Relaxing, Scenic, Outdoors, Nature & Wildlife, Family-Friendly, Kid-Friendly, Elderly-Friendly, Couples, Walking, Full-Day",1.5 hours,3 hours,15,GBP
69,18,Visiting the Great Pagoda,Visiting the Great Pagoda at Kew Palace,Experience the stunning 10-storey pagoda in the heart of London.,"Scenic, Architecture, Traditional, Family-Friendly, Kid-Friendly, Guided, Educational, Short (1-2 hours)",1 hour,1.5 hours,10,GBP
70,18,Learning at the botanical exhibitions,Learning at the botanical exhibitions at Kew Palace,Interactive learning experience with historical and botanical elements.,"Educational, History, Traditional, Museum, Family-Friendly, Kid-Friendly, Guided, Technology, Short (1-2 hours)",1.5 hours,2.5 hours,12,GBP
71,19,Touring the Georgian mansion,Touring the Georgian mansion at Osterley Park House,Explore the opulent interiors and extensive art collection of a Georgian mansion.,"Educational, History, Guided, Architecture, Traditional, Family-Friendly, Kid-Friendly, Scenic, Short (1-2 hours)",1.5 hours,2.5 hours,12,GBP
72,19,Strolling through the gardens,Strolling through the gardens at Osterley Park House,Enjoying the beautiful scenery and historical architecture of Osterley Park House.,"Relaxing, Scenic, Outdoors, Nature & Wildlife, Family-Friendly, Kid-Friendly, Elderly-Friendly, Couples, Walking, Short (1-2 hours)",1 hour,2 hours,8,GBP
73,19,Enjoying the tea room,Enjoying the tea room at Osterley Park House,Experience a traditional English afternoon tea in a stunning historic setting.,"Cultural Immersion, Local Cuisine, Traditional, Gourmet Experiences, Couples, Family-Friendly, Kid-Friendly, Mid-Range, Short (1-2 hours), Low Exertion",1 hour,1.5 hours,15,GBP
74,20,Touring the National Physical Laboratory,Touring the National Physical Laboratory at Bushy House,Explore groundbreaking scientific research and innovation at the National Physical Laboratory.,"Educational, Science & Innovation, Guided, Technology, Family-Friendly, Kid-Friendly, Indoor, Short (1-2 hours)",1.5 hours,2.5 hours,10,GBP
75,21,Hiking the Inca Trail,Hiking the Inca Trail to Machu Picchu,Trek the ancient Inca Trail through the Andes to reach the iconic Machu Picchu.,"Adventure, Advanced, Outdoor, Scenic, Bucket List, Unique Experience, High Exertion, Guided, South America, Remote Locations, UNESCO World Heritage Sites, Mountain Regions, Multi-Day",4 days,5 days,500,USD
76,22,Exploring the Pyramids of Giza,Exploring the Pyramids of Giza,"Visit the ancient pyramids, one of the Seven Wonders of the Ancient World, in the Egyptian desert.","Educational, History, Guided, Traditional, Bucket List, UNESCO World Heritage Sites, Africa, Desert Activities, Popular Tourist Destinations, Half-Day, Full-Day, Moderate Exertion",3 hours,5 hours,60,EGP
77,23,Snorkeling the Great Barrier Reef,Snorkeling the Great Barrier Reef,Dive into the world’s largest coral reef system and explore its vibrant marine life.,"Adventure, Intermediate, Outdoor, Scenic, Nature & Wildlife, Guided, Unique Experience, Bucket List, Australia & Oceania, Islands, Coastal Regions, UNESCO World Heritage Sites, Half-Day, Full-Day",2 hours,6 hours,150,AUD
78,24,Exploring the Colosseum,Exploring the Colosseum in Rome,"Tour the iconic Roman Colosseum, an ancient amphitheater that hosted gladiator battles.","Educational, History, Guided, Traditional, Bucket List, UNESCO World Heritage Sites, Europe, Urban Centers, Popular Tourist Destinations, Architecture, Half-Day",2 hours,3 hours,18,EUR
79,25,Climbing Mount Kilimanjaro,Climbing Mount Kilimanjaro,"Summit the highest peak in Africa, Mount Kilimanjaro, through a guided expedition.","Adventure, Advanced, Outdoor, Scenic, Bucket List, Unique Experience, High Exertion, Guided, Africa, Mountain Regions, Remote Locations, Multi-Day",7 days,10 days,1200,USD
80,26,Visiting the Taj Mahal,Visiting the Taj Mahal in Agra,"Explore the stunning marble mausoleum, a UNESCO World Heritage site and symbol of eternal love.","Educational, History, Guided, Traditional, Bucket List, UNESCO World Heritage Sites, Asia, Urban Centers, Popular Tourist Destinations, Architecture, Half-Day, Full-Day",2 hours,4 hours,15,INR
81,27,Walking the Great Wall of China,Walking the Great Wall of China,"Experience one of the world's greatest engineering feats, stretching over 13,000 miles.","Educational, History, Guided, Traditional, Scenic, Bucket List, UNESCO World Heritage Sites, Asia, Mountain Regions, Popular Tourist Destinations, Half-Day, Full-Day, Moderate Exertion",4 hours,8 hours,40,CNY
